{
  "schema_version": "0.3.0",
  "artifact_type": "verification_results",
  "artifact_id": "verification_demo_001",
  "run_id": "run_demo_001",
  "iteration": 0,
  "producer": "verifier",
  "mode": "development",
  "created_at": "2026-10-07T02:00:00Z",
  "status": "completed",
  "input_refs": [],
  "errors": [],
  "runtime_metrics": {
    "duration_ms": 10,
    "llm_calls": 0,
    "input_tokens": 0,
    "output_tokens": 0,
    "peak_memory_mb": 32
  },
  "data": {
    "source_graph_revision": 1,
    "scenarios_sha256": "e31f1ef9052a0e135e92abd1090aa4b0b5115ef7e50a75995f6f8729b7ebd9ec",
    "results": [
      {
        "verification_id": "verification_idor_001",
        "candidate_id": "candidate_idor_001",
        "scenario_id": "scenario_idor_001",
        "decision_id": "decision_idor_001",
        "policy_decision": "allow",
        "execution_status": "completed",
        "result": "success",
        "reason": "다른 계정 소유 주문을 조회함",
        "steps": [],
        "evidence_refs": [
          {
            "evidence_id": "verification_idor_response",
            "kind": "response",
            "path": "evidence/verifier/verification_idor_response.json",
            "sha256": "eeeeeeeeeeeeeeeeeeeeeeeeeeeeeeeeeeeeeeeeeeeeeeeeeeeeeeeeeeeeeeee",
            "redacted": true
          }
        ],
        "errors": []
      },
      {
        "verification_id": "verification_workflow_001",
        "candidate_id": "candidate_workflow_001",
        "scenario_id": "scenario_workflow_001",
        "decision_id": "decision_workflow_001",
        "policy_decision": "require_approval",
        "execution_status": "not_executed",
        "result": "blocked",
        "reason": "사용자 승인 대기",
        "steps": [],
        "evidence_refs": [],
        "errors": []
      }
    ],
    "graph_updates": {
      "source_verification_ids": [
        "verification_idor_001"
      ],
      "nodes": [],
      "relationships": [
        {
          "relationship_id": "verified_access_user_a_order_b",
          "source_account_id": "account_user_a",
          "target_id": "resource_order_b",
          "relation_type": "VERIFIED_ACCESS",
          "properties": {
            "action": "read_order"
          },
          "basis": "verified",
          "evidence_refs": [
            {
              "evidence_id": "verification_idor_response",
              "kind": "response",
              "path": "evidence/verifier/verification_idor_response.json",
              "sha256": "eeeeeeeeeeeeeeeeeeeeeeeeeeeeeeeeeeeeeeeeeeeeeeeeeeeeeeeeeeeeeeee",
              "redacted": true
            }
          ]
        }
      ]
    }
  }
}
